,index,number,link,title,img
0,"Dr. Elissa Epel: Control Stress for Healthy Eating, Metabolism & Aging | Huberman Lab Podcast",1.0,https://www.youtube.com/watch?v=ulHrUVV3Kq4&list=UU2D2CMWXMOVWx7giW1n3LIg&index=1&pp=iAQB,"Dr. Elissa Epel: Control Stress for Healthy Eating, Metabolism & Aging | Huberman Lab Podcast",https://i.ytimg.com/vi/ulHrUVV3Kq4/hqdefault.jpg?sqp=-oaymwEcCNACELwBSFXyq4qpAw4IARUAAIhCGAFwAcABBg==&rs=AOn4CLB13UAxQQikM0-jxglak0UryMxafQ
1,Leverage Dopamine to Overcome Procrastination & Optimize Effort | Huberman Lab Podcast,2.0,https://www.youtube.com/watch?v=K-TW2Chpz4k&list=UU2D2CMWXMOVWx7giW1n3LIg&index=2&pp=iAQB,Leverage Dopamine to Overcome Procrastination & Optimize Effort | Huberman Lab Podcast,https://i.ytimg.com/vi/K-TW2Chpz4k/hqdefault.jpg?sqp=-oaymwEcCNACELwBSFXyq4qpAw4IARUAAIhCGAFwAcABBg==&rs=AOn4CLBDFyfD5lRWiMmma3ls4XH_ZaUBFw
2,"AMA #5: Intrusive Thoughts, CGMs, Behavioral Change, Naps & NSDR",3.0,https://www.youtube.com/watch?v=cp9GXl9Qk_s&list=UU2D2CMWXMOVWx7giW1n3LIg&index=3&pp=iAQB,"AMA #5: Intrusive Thoughts, CGMs, Behavioral Change, Naps & NSDR",https://i.ytimg.com/vi/cp9GXl9Qk_s/hqdefault.jpg?sqp=-oaymwEcCNACELwBSFXyq4qpAw4IARUAAIhCGAFwAcABBg==&rs=AOn4CLDUyXqqESuwwisEfVv8xsyIm0C-MQ
3,"Dr. Peter Attia: Improve Vitality, Emotional & Physical Health & Lifespan | Huberman Lab Podcast",4.0,https://www.youtube.com/watch?v=ufsIA5NARIo&list=UU2D2CMWXMOVWx7giW1n3LIg&index=4&pp=iAQB,"Dr. Peter Attia: Improve Vitality, Emotional & Physical Health & Lifespan | Huberman Lab Podcast",https://i.ytimg.com/vi/ufsIA5NARIo/hqdefault.jpg?sqp=-oaymwEcCNACELwBSFXyq4qpAw4IARUAAIhCGAFwAcABBg==&rs=AOn4CLCkjq-NX6HvghOAMSaZaE8zBj3uHQ
4,"Dr. Satchin Panda: Intermittent Fasting to Improve Health, Cognition & Longevity | Huberman Lab",5.0,https://www.youtube.com/watch?v=7R3-3HR6-u4&list=UU2D2CMWXMOVWx7giW1n3LIg&index=5&pp=iAQB,"Dr. Satchin Panda: Intermittent Fasting to Improve Health, Cognition & Longevity | Huberman Lab",https://i.ytimg.com/vi/7R3-3HR6-u4/hqdefault.jpg?sqp=-oaymwEcCNACELwBSFXyq4qpAw4IARUAAIhCGAFwAcABBg==&rs=AOn4CLBYN69ewoONrcmXii4zPaCuRv-PhQ
5,How to Optimize Your Water Quality & Intake for Health | Huberman Lab Podcast,6.0,https://www.youtube.com/watch?v=at37Y8rKDlA&list=UU2D2CMWXMOVWx7giW1n3LIg&index=6&pp=iAQB,How to Optimize Your Water Quality & Intake for Health | Huberman Lab Podcast,https://i.ytimg.com/vi/at37Y8rKDlA/hqdefault.jpg?sqp=-oaymwEcCNACELwBSFXyq4qpAw4IARUAAIhCGAFwAcABBg==&rs=AOn4CLAHRdrUTdd2NXH9YMjnDxGWoF3RRA
6,Dr. Oded Rechavi: Genes & the Inheritance of Memories Across Generations | Huberman Lab Podcast,7.0,https://www.youtube.com/watch?v=CDUetQMKM6g&list=UU2D2CMWXMOVWx7giW1n3LIg&index=7&pp=iAQB,Dr. Oded Rechavi: Genes & the Inheritance of Memories Across Generations | Huberman Lab Podcast,https://i.ytimg.com/vi/CDUetQMKM6g/hqdefault.jpg?sqp=-oaymwEcCNACELwBSFXyq4qpAw4IARUAAIhCGAFwAcABBg==&rs=AOn4CLAA13lXkmhBNpvYH1dJR7IDcUVmww
7,"AMA #4: Maintain Motivation, Improve REM Sleep, Set Goals, Manage Anxiety & More",8.0,https://www.youtube.com/watch?v=S8nPJU9xkNw&list=UU2D2CMWXMOVWx7giW1n3LIg&index=8&pp=iAQB,"AMA #4: Maintain Motivation, Improve REM Sleep, Set Goals, Manage Anxiety & More",https://i.ytimg.com/vi/S8nPJU9xkNw/hqdefault.jpg?sqp=-oaymwEcCNACELwBSFXyq4qpAw4IARUAAIhCGAFwAcABBg==&rs=AOn4CLB-Cvg6mBTCm0RsxD9CelfrFtf6Jg
8,Dr. Andy Galpin: Optimal Nutrition & Supplementation for Fitness | Huberman Lab Guest Series,9.0,https://www.youtube.com/watch?v=q37ARYnRDGc&list=UU2D2CMWXMOVWx7giW1n3LIg&index=9&pp=iAQB,Dr. Andy Galpin: Optimal Nutrition & Supplementation for Fitness | Huberman Lab Guest Series,https://i.ytimg.com/vi/q37ARYnRDGc/hqdefault.jpg?sqp=-oaymwEcCNACELwBSFXyq4qpAw4IARUAAIhCGAFwAcABBg==&rs=AOn4CLAfMrBKtg_e_NI6RFB9XN96gdAP2A
9,"How to Breathe Correctly for Optimal Health, Mood, Learning & Performance | Huberman Lab Podcast",10.0,https://www.youtube.com/watch?v=x4m_PdFbu-s&list=UU2D2CMWXMOVWx7giW1n3LIg&index=10&pp=iAQB,"How to Breathe Correctly for Optimal Health, Mood, Learning & Performance | Huberman Lab Podcast",https://i.ytimg.com/vi/x4m_PdFbu-s/hqdefault.jpg?sqp=-oaymwEcCNACELwBSFXyq4qpAw4IARUAAIhCGAFwAcABBg==&rs=AOn4CLAb_7w9u04-sf7FmV7VNDYlDZE_iQ
10,Dr. Andy Galpin: Maximize Recovery to Achieve Fitness & Performance Goals | Huberman Lab,11.0,https://www.youtube.com/watch?v=juD99_sPWGU&list=UU2D2CMWXMOVWx7giW1n3LIg&index=11&pp=iAQB,Dr. Andy Galpin: Maximize Recovery to Achieve Fitness & Performance Goals | Huberman Lab,https://i.ytimg.com/vi/juD99_sPWGU/hqdefault.jpg?sqp=-oaymwEcCNACELwBSFXyq4qpAw4IARUAAIhCGAFwAcABBg==&rs=AOn4CLAAa5joPawv9VhMWPrCKc-R_hMDwQ
11,"Dr. Gina Poe: Use Sleep to Enhance Learning, Memory & Emotional State | Huberman Lab Podcast",12.0,https://www.youtube.com/watch?v=BMTt8gSl13s&list=UU2D2CMWXMOVWx7giW1n3LIg&index=12&pp=iAQB,"Dr. Gina Poe: Use Sleep to Enhance Learning, Memory & Emotional State | Huberman Lab Podcast",https://i.ytimg.com/vi/BMTt8gSl13s/hqdefault.jpg?sqp=-oaymwEcCNACELwBSFXyq4qpAw4IARUAAIhCGAFwAcABBg==&rs=AOn4CLBDTC9akgdVuiwdDqMRk3BIuXrGkQ
12,Dr. Andy Galpin: Optimize Your Training Program for Fitness & Longevity | Huberman Lab Guest Series,13.0,https://www.youtube.com/watch?v=UIy-WQCZd4M&list=UU2D2CMWXMOVWx7giW1n3LIg&index=13&pp=iAQB,Dr. Andy Galpin: Optimize Your Training Program for Fitness & Longevity | Huberman Lab Guest Series,https://i.ytimg.com/vi/UIy-WQCZd4M/hqdefault.jpg?sqp=-oaymwEcCNACELwBSFXyq4qpAw4IARUAAIhCGAFwAcABBg==&rs=AOn4CLC7iHQQxTGOESM0ahYsapyszkjdSg
13,How to Stop Headaches Using Science-Based Approaches | Huberman Lab Podcast,14.0,https://www.youtube.com/watch?v=CGjdgy0cwGk&list=UU2D2CMWXMOVWx7giW1n3LIg&index=14&pp=iAQB,How to Stop Headaches Using Science-Based Approaches | Huberman Lab Podcast,https://i.ytimg.com/vi/CGjdgy0cwGk/hqdefault.jpg?sqp=-oaymwEcCNACELwBSFXyq4qpAw4IARUAAIhCGAFwAcABBg==&rs=AOn4CLDSp8gPattB4XWuIAVQcu_QuCK1tg
14,Dr. Andy Galpin: How to Build Physical Endurance & Lose Fat | Huberman Lab Guest Series,15.0,https://www.youtube.com/watch?v=oNkDA2F7CjM&list=UU2D2CMWXMOVWx7giW1n3LIg&index=15&pp=iAQB,Dr. Andy Galpin: How to Build Physical Endurance & Lose Fat | Huberman Lab Guest Series,https://i.ytimg.com/vi/oNkDA2F7CjM/hqdefault.jpg?sqp=-oaymwEcCNACELwBSFXyq4qpAw4IARUAAIhCGAFwAcABBg==&rs=AOn4CLDNLox3XrJd3efEzJNtBF1UXJWU_w
15,Dr. Sara Gottfried: How to Optimize Female Hormone Health for Vitality & Longevity | Huberman Lab,16.0,https://www.youtube.com/watch?v=GVRDGQhoEYQ&list=UU2D2CMWXMOVWx7giW1n3LIg&index=16&pp=iAQB,Dr. Sara Gottfried: How to Optimize Female Hormone Health for Vitality & Longevity | Huberman Lab,https://i.ytimg.com/vi/GVRDGQhoEYQ/hqdefault.jpg?sqp=-oaymwEcCNACELwBSFXyq4qpAw4IARUAAIhCGAFwAcABBg==&rs=AOn4CLA0l_EKSR1rUmO_u7XRTAJ9EtzyLw
16,Dr. Andy Galpin: Optimal Protocols to Build Strength & Grow Muscles | Huberman Lab Guest Series,17.0,https://www.youtube.com/watch?v=CyDLbrZK75U&list=UU2D2CMWXMOVWx7giW1n3LIg&index=17&pp=iAQB,Dr. Andy Galpin: Optimal Protocols to Build Strength & Grow Muscles | Huberman Lab Guest Series,https://i.ytimg.com/vi/CyDLbrZK75U/hqdefault.jpg?sqp=-oaymwEcCNACELwBSFXyq4qpAw4IARUAAIhCGAFwAcABBg==&rs=AOn4CLDNAkdADe61fr4pKllFPgsMqW03yQ
17,How to Optimize Fertility in Males & Females | Huberman Lab Podcast,18.0,https://www.youtube.com/watch?v=O1YRwWmue4Y&list=UU2D2CMWXMOVWx7giW1n3LIg&index=18&pp=iAQB,How to Optimize Fertility in Males & Females | Huberman Lab Podcast,https://i.ytimg.com/vi/O1YRwWmue4Y/hqdefault.jpg?sqp=-oaymwEcCNACELwBSFXyq4qpAw4IARUAAIhCGAFwAcABBg==&rs=AOn4CLCQocO934_fyrV7rzbFcp6RmJMyKA
18,Dr. Andy Galpin: How to Assess & Improve All Aspects of Your Fitness | Huberman Lab Guest Series,19.0,https://www.youtube.com/watch?v=zEYE-vcVKy8&list=UU2D2CMWXMOVWx7giW1n3LIg&index=19&pp=iAQB,Dr. Andy Galpin: How to Assess & Improve All Aspects of Your Fitness | Huberman Lab Guest Series,https://i.ytimg.com/vi/zEYE-vcVKy8/hqdefault.jpg?sqp=-oaymwEcCNACELwBSFXyq4qpAw4IARUAAIhCGAFwAcABBg==&rs=AOn4CLAkp1UsCeLMgdb9tkJE12BFm151gQ
19,Rick Rubin: How to Access Your Creativity | Huberman Lab Podcast,20.0,https://www.youtube.com/watch?v=ycOBZZeVeAc&list=UU2D2CMWXMOVWx7giW1n3LIg&index=20&pp=iAQB,Rick Rubin: How to Access Your Creativity | Huberman Lab Podcast,https://i.ytimg.com/vi/ycOBZZeVeAc/hqdefault.jpg?sqp=-oaymwEcCNACELwBSFXyq4qpAw4IARUAAIhCGAFwAcABBg==&rs=AOn4CLD_koaA4cP-qCWKpKHZvZ8xgraacQ
20,"AMA #3: Adaptogens, Fasting & Fertility, Bluetooth/EMF Risks, Cognitive Load Limits & More",21.0,https://www.youtube.com/watch?v=uak_dXHh6s4&list=UU2D2CMWXMOVWx7giW1n3LIg&index=21&pp=iAQB,"AMA #3: Adaptogens, Fasting & Fertility, Bluetooth/EMF Risks, Cognitive Load Limits & More",https://i.ytimg.com/vi/uak_dXHh6s4/hqdefault.jpg?sqp=-oaymwEcCNACELwBSFXyq4qpAw4IARUAAIhCGAFwAcABBg==&rs=AOn4CLBzJN9bTXw1SL7P0n-E89gBMPRLkA
21,Developing a Rational Approach to Supplementation for Health & Performance | Huberman Lab Podcast,22.0,https://www.youtube.com/watch?v=tLS6t3FVOTI&list=UU2D2CMWXMOVWx7giW1n3LIg&index=22&pp=iAQB,Developing a Rational Approach to Supplementation for Health & Performance | Huberman Lab Podcast,https://i.ytimg.com/vi/tLS6t3FVOTI/hqdefault.jpg?sqp=-oaymwEcCNACELwBSFXyq4qpAw4IARUAAIhCGAFwAcABBg==&rs=AOn4CLDHksmX0dzP0vyCk94ClCfh51nCkg
22,"Dr. Sam Harris: Using Meditation to Focus, View Consciousness & Expand Your Mind | Huberman Lab 105",23.0,https://www.youtube.com/watch?v=-wIt_WsJGfw&list=UU2D2CMWXMOVWx7giW1n3LIg&index=23&pp=iAQB,"Dr. Sam Harris: Using Meditation to Focus, View Consciousness & Expand Your Mind | Huberman Lab 105",https://i.ytimg.com/vi/-wIt_WsJGfw/hqdefault.jpg?sqp=-oaymwEcCNACELwBSFXyq4qpAw4IARUAAIhCGAFwAcABBg==&rs=AOn4CLB8i_qlpTV2FPoMTUyoXmwxKUDQBQ
23,"Jocko Willink: How to Become Resilient, Forge Your Identity & Lead Others | Huberman Lab Podcast 104",24.0,https://www.youtube.com/watch?v=__RAXBLt1iM&list=UU2D2CMWXMOVWx7giW1n3LIg&index=24&pp=iAQB,"Jocko Willink: How to Become Resilient, Forge Your Identity & Lead Others | Huberman Lab Podcast 104",https://i.ytimg.com/vi/__RAXBLt1iM/hqdefault.jpg?sqp=-oaymwEcCNACELwBSFXyq4qpAw4IARUAAIhCGAFwAcABBg==&rs=AOn4CLAH8tAfpxnKbu7JOTI5Qzh4VuN-0g
24,The Science of Creativity & How to Enhance Creative Innovation | Huberman Lab Podcast 103,25.0,https://www.youtube.com/watch?v=KPlJcD-o-4Q&list=UU2D2CMWXMOVWx7giW1n3LIg&index=25&pp=iAQB,The Science of Creativity & How to Enhance Creative Innovation | Huberman Lab Podcast 103,https://i.ytimg.com/vi/KPlJcD-o-4Q/hqdefault.jpg?sqp=-oaymwEcCNACELwBSFXyq4qpAw4IARUAAIhCGAFwAcABBg==&rs=AOn4CLCgwJdBY4ZK7uYjyS7R0sviwM0GTQ
25,"LIVE EVENT Q&A: Dr. Andrew Huberman Question & Answer in New York, NY",26.0,https://www.youtube.com/watch?v=uwWOc_RqTBA&list=UU2D2CMWXMOVWx7giW1n3LIg&index=26&pp=iAQB,"LIVE EVENT Q&A: Dr. Andrew Huberman Question & Answer in New York, NY",https://i.ytimg.com/vi/uwWOc_RqTBA/hqdefault.jpg?sqp=-oaymwEcCNACELwBSFXyq4qpAw4IARUAAIhCGAFwAcABBg==&rs=AOn4CLAZ9rEMfu6uhOn-cHgF1xXtUHLxFQ
26,Dr. Kyle Gillett: Tools for Hormone Optimization in Males | Huberman Lab Podcast 102,27.0,https://www.youtube.com/watch?v=O640yAgq5f8&list=UU2D2CMWXMOVWx7giW1n3LIg&index=27&pp=iAQB,Dr. Kyle Gillett: Tools for Hormone Optimization in Males | Huberman Lab Podcast 102,https://i.ytimg.com/vi/O640yAgq5f8/hqdefault.jpg?sqp=-oaymwEcCNACELwBSFXyq4qpAw4IARUAAIhCGAFwAcABBg==&rs=AOn4CLB47Uk147jRFBTf9ORr5j_P4Gf4Kw
27,"AMA #2: Improve Sleep, Reduce Sugar Cravings, Optimal Protein Intake, Stretching Frequency & More",28.0,https://www.youtube.com/watch?v=vZ4kOr38JhY&list=UU2D2CMWXMOVWx7giW1n3LIg&index=28&pp=iAQB,"AMA #2: Improve Sleep, Reduce Sugar Cravings, Optimal Protein Intake, Stretching Frequency & More",https://i.ytimg.com/vi/vZ4kOr38JhY/hqdefault.jpg?sqp=-oaymwEcCNACELwBSFXyq4qpAw4IARUAAIhCGAFwAcABBg==&rs=AOn4CLCmgr7NXf3ln8qatQAEBuL--wiy8w
28,Using Caffeine to Optimize Mental & Physical Performance | Huberman Lab Podcast 101,29.0,https://www.youtube.com/watch?v=iw97uvIge7c&list=UU2D2CMWXMOVWx7giW1n3LIg&index=29&pp=iAQB,Using Caffeine to Optimize Mental & Physical Performance | Huberman Lab Podcast 101,https://i.ytimg.com/vi/iw97uvIge7c/hqdefault.jpg?sqp=-oaymwEcCNACELwBSFXyq4qpAw4IARUAAIhCGAFwAcABBg==&rs=AOn4CLAhfAaIQ940r6rjV2_rEFyxb36fkg
29,"Dr Lex Fridman: Navigating Conflict, Finding Purpose & Maintaining Drive | Huberman Lab Podcast #100",30.0,https://www.youtube.com/watch?v=6I5I56uVvLw&list=UU2D2CMWXMOVWx7giW1n3LIg&index=30&pp=iAQB,"Dr Lex Fridman: Navigating Conflict, Finding Purpose & Maintaining Drive | Huberman Lab Podcast #100",https://i.ytimg.com/vi/6I5I56uVvLw/hqdefault.jpg?sqp=-oaymwEcCNACELwBSFXyq4qpAw4IARUAAIhCGAFwAcABBg==&rs=AOn4CLC-PXS3uVRV026hwLCoAXaIAx-A8g
30,Dr. Chris Palmer: Diet & Nutrition for Mental Health | Huberman Lab Podcast #99,31.0,https://www.youtube.com/watch?v=xjEFo3a1AnI&list=UU2D2CMWXMOVWx7giW1n3LIg&index=31&pp=iAQB,Dr. Chris Palmer: Diet & Nutrition for Mental Health | Huberman Lab Podcast #99,https://i.ytimg.com/vi/xjEFo3a1AnI/hqdefault.jpg?sqp=-oaymwEcCNACELwBSFXyq4qpAw4IARUAAIhCGAFwAcABBg==&rs=AOn4CLDBPc4OgtVqZqIY-IKG76W10bxcZQ
31,Science-Based Tools for Increasing Happiness | Huberman Lab Podcast #98,32.0,https://www.youtube.com/watch?v=LTGGyQS1fZE&list=UU2D2CMWXMOVWx7giW1n3LIg&index=32&pp=iAQB,Science-Based Tools for Increasing Happiness | Huberman Lab Podcast #98,https://i.ytimg.com/vi/LTGGyQS1fZE/hqdefault.jpg?sqp=-oaymwEcCNACELwBSFXyq4qpAw4IARUAAIhCGAFwAcABBg==&rs=AOn4CLCx_2Vs65JF9PoTo1kriMdQ_qu3UA
32,"LIVE EVENT Q&A: Dr. Andrew Huberman Question & Answer in Los Angeles, CA",33.0,https://www.youtube.com/watch?v=TO0WUTq5zYI&list=UU2D2CMWXMOVWx7giW1n3LIg&index=33&pp=iAQB,"LIVE EVENT Q&A: Dr. Andrew Huberman Question & Answer in Los Angeles, CA",https://i.ytimg.com/vi/TO0WUTq5zYI/hqdefault.jpg?sqp=-oaymwEcCNACELwBSFXyq4qpAw4IARUAAIhCGAFwAcABBg==&rs=AOn4CLBD2LgsN3zv97CMnG3mzYvpCKSH0w
33,"Dr Layne Norton: The Science of Eating for Health, Fat Loss & Lean Muscle | Huberman Lab Podcast #97",34.0,https://www.youtube.com/watch?v=K4Ze-Sp6aUE&list=UU2D2CMWXMOVWx7giW1n3LIg&index=34&pp=iAQB,"Dr Layne Norton: The Science of Eating for Health, Fat Loss & Lean Muscle | Huberman Lab Podcast #97",https://i.ytimg.com/vi/K4Ze-Sp6aUE/hqdefault.jpg?sqp=-oaymwEcCNACELwBSFXyq4qpAw4IARUAAIhCGAFwAcABBg==&rs=AOn4CLAM6iYHsnKyivSzPLJcAUFrecr97A
34,"AMA #1: Leveraging Ultradian Cycles, How to Protect Your Brain, Seed Oils Examined and More",35.0,https://www.youtube.com/watch?v=lsODSDmY4CY&list=UU2D2CMWXMOVWx7giW1n3LIg&index=35&pp=iAQB,"AMA #1: Leveraging Ultradian Cycles, How to Protect Your Brain, Seed Oils Examined and More",https://i.ytimg.com/vi/lsODSDmY4CY/hqdefault.jpg?sqp=-oaymwEcCNACELwBSFXyq4qpAw4IARUAAIhCGAFwAcABBg==&rs=AOn4CLBBgY58Otx5wqTn3sJfSuesRFvXYA
35,How Meditation Works & Science-Based Effective Meditations | Huberman Lab Podcast #96,36.0,https://www.youtube.com/watch?v=wTBSGgbIvsY&list=UU2D2CMWXMOVWx7giW1n3LIg&index=36&pp=iAQB,How Meditation Works & Science-Based Effective Meditations | Huberman Lab Podcast #96,https://i.ytimg.com/vi/wTBSGgbIvsY/hqdefault.jpg?sqp=-oaymwEcCNACELwBSFXyq4qpAw4IARUAAIhCGAFwAcABBg==&rs=AOn4CLAwdG_mORzSeEEBf4SK_a2e_OJC_w
36,Dr. Eddie Chang: The Science of Learning & Speaking Languages | Huberman Lab Podcast #95,37.0,https://www.youtube.com/watch?v=Z7MU6zrAXsM&list=UU2D2CMWXMOVWx7giW1n3LIg&index=37&pp=iAQB,Dr. Eddie Chang: The Science of Learning & Speaking Languages | Huberman Lab Podcast #95,https://i.ytimg.com/vi/Z7MU6zrAXsM/hqdefault.jpg?sqp=-oaymwEcCNACELwBSFXyq4qpAw4IARUAAIhCGAFwAcABBg==&rs=AOn4CLC5AkX5WEjZbCj9FTgT3DKLmCiW7Q
37,Fitness Toolkit: Protocol & Tools to Optimize Physical Health | Huberman Lab Podcast #94,38.0,https://www.youtube.com/watch?v=q1Ss8sTbFBY&list=UU2D2CMWXMOVWx7giW1n3LIg&index=38&pp=iAQB,Fitness Toolkit: Protocol & Tools to Optimize Physical Health | Huberman Lab Podcast #94,https://i.ytimg.com/vi/q1Ss8sTbFBY/hqdefault.jpg?sqp=-oaymwEcCNACELwBSFXyq4qpAw4IARUAAIhCGAFwAcABBg==&rs=AOn4CLDWkApmsJdwknOiptfxkgyoQ9DR-A
38,Dr. Nolan Williams: Psychedelics & Neurostimulation for Brain Rewiring | Huberman Lab Podcast #93,39.0,https://www.youtube.com/watch?v=X4QE6t-MkYE&list=UU2D2CMWXMOVWx7giW1n3LIg&index=39&pp=iAQB,Dr. Nolan Williams: Psychedelics & Neurostimulation for Brain Rewiring | Huberman Lab Podcast #93,https://i.ytimg.com/vi/X4QE6t-MkYE/hqdefault.jpg?sqp=-oaymwEcCNACELwBSFXyq4qpAw4IARUAAIhCGAFwAcABBg==&rs=AOn4CLA34szVt9HtvQYKkRs0Rbe9LrLO9w
39,The Effects of Cannabis (Marijuana) on the Brain & Body | Huberman Lab Podcast #92,40.0,https://www.youtube.com/watch?v=gXvuJu1kt48&list=UU2D2CMWXMOVWx7giW1n3LIg&index=40&pp=iAQB,The Effects of Cannabis (Marijuana) on the Brain & Body | Huberman Lab Podcast #92,https://i.ytimg.com/vi/gXvuJu1kt48/hqdefault.jpg?sqp=-oaymwEcCNACELwBSFXyq4qpAw4IARUAAIhCGAFwAcABBg==&rs=AOn4CLBTTFLRlsq_ztJEOXLzUklye0K47g
40,Dr. Casey Halpern: Biology & Treatments for Compulsive Eating & Behaviors | Huberman Lab Podcast #91,41.0,https://www.youtube.com/watch?v=Nr5xb-QCBGA&list=UU2D2CMWXMOVWx7giW1n3LIg&index=41&pp=iAQB,Dr. Casey Halpern: Biology & Treatments for Compulsive Eating & Behaviors | Huberman Lab Podcast #91,https://i.ytimg.com/vi/Nr5xb-QCBGA/hqdefault.jpg?sqp=-oaymwEcCNACELwBSFXyq4qpAw4IARUAAIhCGAFwAcABBg==&rs=AOn4CLBoE5RM7LmKiuLeCzTrzZ_LWP8k6g
41,Nicotine’s Effects on the Brain & Body & How to Quit Smoking or Vaping | Huberman Lab Podcast #90,42.0,https://www.youtube.com/watch?v=uXs-zPc63kM&list=UU2D2CMWXMOVWx7giW1n3LIg&index=42&pp=iAQB,Nicotine’s Effects on the Brain & Body & How to Quit Smoking or Vaping | Huberman Lab Podcast #90,https://i.ytimg.com/vi/uXs-zPc63kM/hqdefault.jpg?sqp=-oaymwEcCNACELwBSFXyq4qpAw4IARUAAIhCGAFwAcABBg==&rs=AOn4CLAMm8jZ8BXjvSq9_t1E66VhlynQow
42,"Dr. David Anderson: The Biology of Aggression, Mating, & Arousal | Huberman Lab Podcast #89",43.0,https://www.youtube.com/watch?v=uxZFl4BDOGk&list=UU2D2CMWXMOVWx7giW1n3LIg&index=43&pp=iAQB,"Dr. David Anderson: The Biology of Aggression, Mating, & Arousal | Huberman Lab Podcast #89",https://i.ytimg.com/vi/uxZFl4BDOGk/hqdefault.jpg?sqp=-oaymwEcCNACELwBSFXyq4qpAw4IARUAAIhCGAFwAcABBg==&rs=AOn4CLDILGAhZuPJ46IcFxKWtSxXSQBp9w
43,Focus Toolkit: Tools to Improve Your Focus & Concentration | Huberman Lab Podcast #88,44.0,https://www.youtube.com/watch?v=yb5zpo5WDG4&list=UU2D2CMWXMOVWx7giW1n3LIg&index=44&pp=iAQB,Focus Toolkit: Tools to Improve Your Focus & Concentration | Huberman Lab Podcast #88,https://i.ytimg.com/vi/yb5zpo5WDG4/hqdefault.jpg?sqp=-oaymwEcCNACELwBSFXyq4qpAw4IARUAAIhCGAFwAcABBg==&rs=AOn4CLCOXK6O0-Sv96Ygx0D3H3oWW6DvKg
44,"LIVE EVENT Q&A: Dr. Andrew Huberman Question & Answer in Portland, OR",45.0,https://www.youtube.com/watch?v=3_auLYOilb8&list=UU2D2CMWXMOVWx7giW1n3LIg&index=45&pp=iAQB,"LIVE EVENT Q&A: Dr. Andrew Huberman Question & Answer in Portland, OR",https://i.ytimg.com/vi/3_auLYOilb8/hqdefault.jpg?sqp=-oaymwEcCNACELwBSFXyq4qpAw4IARUAAIhCGAFwAcABBg==&rs=AOn4CLCTqIeyofBrEynXEmh45RblOuyFlQ
45,"Dr. Erich Jarvis: The Neuroscience of Speech, Language & Music | Huberman Lab Podcast #87",46.0,https://www.youtube.com/watch?v=LVxL_p_kToc&list=UU2D2CMWXMOVWx7giW1n3LIg&index=46&pp=iAQB,"Dr. Erich Jarvis: The Neuroscience of Speech, Language & Music | Huberman Lab Podcast #87",https://i.ytimg.com/vi/LVxL_p_kToc/hqdefault.jpg?sqp=-oaymwEcCNACELwBSFXyq4qpAw4IARUAAIhCGAFwAcABBg==&rs=AOn4CLDylnRhHwxJS4auZ2OiOUjqsZig7g
46,"What Alcohol Does to Your Body, Brain & Health | Huberman Lab Podcast #86",47.0,https://www.youtube.com/watch?v=DkS1pkKpILY&list=UU2D2CMWXMOVWx7giW1n3LIg&index=47&pp=iAQB,"What Alcohol Does to Your Body, Brain & Health | Huberman Lab Podcast #86",https://i.ytimg.com/vi/DkS1pkKpILY/hqdefault.jpg?sqp=-oaymwEcCNACELwBSFXyq4qpAw4IARUAAIhCGAFwAcABBg==&rs=AOn4CLB6VVW1Fa1wY3rXL6eX8pt3xrRS0Q
47,"LIVE EVENT Q&A: Dr. Andrew Huberman Question & Answer in Seattle, WA",48.0,https://www.youtube.com/watch?v=2Ds1m5gflCI&list=UU2D2CMWXMOVWx7giW1n3LIg&index=48&pp=iAQB,"LIVE EVENT Q&A: Dr. Andrew Huberman Question & Answer in Seattle, WA",https://i.ytimg.com/vi/2Ds1m5gflCI/hqdefault.jpg?sqp=-oaymwEcCNACELwBSFXyq4qpAw4IARUAAIhCGAFwAcABBg==&rs=AOn4CLBN-N7qcWxEXcn-XmRZryPvr0RCgQ
48,"Dr. Peter Attia: Exercise, Nutrition, Hormones for Vitality & Longevity | Huberman Lab Podcast #85",49.0,https://www.youtube.com/watch?v=DTCmprPCDqc&list=UU2D2CMWXMOVWx7giW1n3LIg&index=49&pp=iAQB,"Dr. Peter Attia: Exercise, Nutrition, Hormones for Vitality & Longevity | Huberman Lab Podcast #85",https://i.ytimg.com/vi/DTCmprPCDqc/hqdefault.jpg?sqp=-oaymwEcCNACELwBSFXyq4qpAw4IARUAAIhCGAFwAcABBg==&rs=AOn4CLAEXCetq3ZKxRLGdSM6yZJbJODGbA
49,Sleep Toolkit: Tools for Optimizing Sleep & Sleep-Wake Timing | Huberman Lab Podcast #84,50.0,https://www.youtube.com/watch?v=h2aWYjSA1Jc&list=UU2D2CMWXMOVWx7giW1n3LIg&index=50&pp=iAQB,Sleep Toolkit: Tools for Optimizing Sleep & Sleep-Wake Timing | Huberman Lab Podcast #84,https://i.ytimg.com/vi/h2aWYjSA1Jc/hqdefault.jpg?sqp=-oaymwEcCNACELwBSFXyq4qpAw4IARUAAIhCGAFwAcABBg==&rs=AOn4CLB8ZXICBWQZRw2q5R8YN2e7sV4FFQ
50,Dr. Emily Balcetis: Tools for Setting & Achieving Goals | Huberman Lab Podcast #83,51.0,https://www.youtube.com/watch?v=7YGZZcXqKxE&list=UU2D2CMWXMOVWx7giW1n3LIg&index=51&pp=iAQB,Dr. Emily Balcetis: Tools for Setting & Achieving Goals | Huberman Lab Podcast #83,https://i.ytimg.com/vi/7YGZZcXqKxE/hqdefault.jpg?sqp=-oaymwEcCNACELwBSFXyq4qpAw4IARUAAIhCGAFwAcABBg==&rs=AOn4CLCk_PTV7N5P0ooiV0STG8hhVZhBqw
51,The Science & Treatment of Bipolar Disorder | Huberman Lab Podcast #82,52.0,https://www.youtube.com/watch?v=m_OazsImOiI&list=UU2D2CMWXMOVWx7giW1n3LIg&index=52&pp=iAQB,The Science & Treatment of Bipolar Disorder | Huberman Lab Podcast #82,https://i.ytimg.com/vi/m_OazsImOiI/hqdefault.jpg?sqp=-oaymwEcCNACELwBSFXyq4qpAw4IARUAAIhCGAFwAcABBg==&rs=AOn4CLCWjqToq8j2lhcWFIQvgweZFXHb2A
52,Dr. Charles Zuker: The Biology of Taste Perception & Sugar Craving | Huberman Lab Podcast #81,53.0,https://www.youtube.com/watch?v=UChhXiFPRgg&list=UU2D2CMWXMOVWx7giW1n3LIg&index=53&pp=iAQB,Dr. Charles Zuker: The Biology of Taste Perception & Sugar Craving | Huberman Lab Podcast #81,https://i.ytimg.com/vi/UChhXiFPRgg/hqdefault.jpg?sqp=-oaymwEcCNACELwBSFXyq4qpAw4IARUAAIhCGAFwAcABBg==&rs=AOn4CLDBmc015fzkqBzEzsRJQhXvDTMHOA
53,Optimize & Control Your Brain Chemistry to Improve Health & Performance | Huberman Lab Podcast #80,54.0,https://www.youtube.com/watch?v=T65RDBiB5Hs&list=UU2D2CMWXMOVWx7giW1n3LIg&index=54&pp=iAQB,Optimize & Control Your Brain Chemistry to Improve Health & Performance | Huberman Lab Podcast #80,https://i.ytimg.com/vi/T65RDBiB5Hs/hqdefault.jpg?sqp=-oaymwEcCNACELwBSFXyq4qpAw4IARUAAIhCGAFwAcABBg==&rs=AOn4CLArxKZkn18LijL822rx8J-wvhc5_w
54,Jeff Cavaliere: Optimize Your Exercise Program with Science-Based Tools | Huberman Lab Podcast #79,55.0,https://www.youtube.com/watch?v=UNCwdFxPtE8&list=UU2D2CMWXMOVWx7giW1n3LIg&index=55&pp=iAQB,Jeff Cavaliere: Optimize Your Exercise Program with Science-Based Tools | Huberman Lab Podcast #79,https://i.ytimg.com/vi/UNCwdFxPtE8/hqdefault.jpg?sqp=-oaymwEcCNACELwBSFXyq4qpAw4IARUAAIhCGAFwAcABBg==&rs=AOn4CLDxGAecHenxO3NYbBvKUNFlucmXeQ
55,The Science & Treatment of Obsessive Compulsive Disorder (OCD) | Huberman Lab Podcast #78,56.0,https://www.youtube.com/watch?v=OadokY8fcAA&list=UU2D2CMWXMOVWx7giW1n3LIg&index=56&pp=iAQB,The Science & Treatment of Obsessive Compulsive Disorder (OCD) | Huberman Lab Podcast #78,https://i.ytimg.com/vi/OadokY8fcAA/hqdefault.jpg?sqp=-oaymwEcCNACELwBSFXyq4qpAw4IARUAAIhCGAFwAcABBg==&rs=AOn4CLDqcp2zlwgPmA9uH7qGFcU6xWmGsQ
56,Ido Portal: The Science & Practice of Movement | Huberman Lab Podcast #77,57.0,https://www.youtube.com/watch?v=a9yFKPmPZ90&list=UU2D2CMWXMOVWx7giW1n3LIg&index=57&pp=iAQB,Ido Portal: The Science & Practice of Movement | Huberman Lab Podcast #77,https://i.ytimg.com/vi/a9yFKPmPZ90/hqdefault.jpg?sqp=-oaymwEcCNACELwBSFXyq4qpAw4IARUAAIhCGAFwAcABBg==&rs=AOn4CLBMz1-mmDgZ0DAh5byCrphhkmKHsA
57,Improve Flexibility with Research-Supported Stretching Protocols | Huberman Lab Podcast #76,58.0,https://www.youtube.com/watch?v=tkH2-_jMCSk&list=UU2D2CMWXMOVWx7giW1n3LIg&index=58&pp=iAQB,Improve Flexibility with Research-Supported Stretching Protocols | Huberman Lab Podcast #76,https://i.ytimg.com/vi/tkH2-_jMCSk/hqdefault.jpg?sqp=-oaymwEcCNACELwBSFXyq4qpAw4IARUAAIhCGAFwAcABBg==&rs=AOn4CLAEptwZbvUI6QtLQSv6poE-EvpUXw
58,"Dr. Paul Conti: Therapy, Treating Trauma & Other Life Challenges | Huberman Lab Podcast #75",59.0,https://www.youtube.com/watch?v=IOl28gj_RXw&list=UU2D2CMWXMOVWx7giW1n3LIg&index=59&pp=iAQB,"Dr. Paul Conti: Therapy, Treating Trauma & Other Life Challenges | Huberman Lab Podcast #75",https://i.ytimg.com/vi/IOl28gj_RXw/hqdefault.jpg?sqp=-oaymwEcCNACELwBSFXyq4qpAw4IARUAAIhCGAFwAcABBg==&rs=AOn4CLD8yRswc2DR4HHlLxVMifbkzZuJPA
59,The Science & Process of Healing from Grief | Huberman Lab Podcast #74,60.0,https://www.youtube.com/watch?v=dzOvi0Aa2EA&list=UU2D2CMWXMOVWx7giW1n3LIg&index=60&pp=iAQB,The Science & Process of Healing from Grief | Huberman Lab Podcast #74,https://i.ytimg.com/vi/dzOvi0Aa2EA/hqdefault.jpg?sqp=-oaymwEcCNACELwBSFXyq4qpAw4IARUAAIhCGAFwAcABBg==&rs=AOn4CLDUtVnhfX-goaZZ5054NnCwKgKz7A
60,Dr. Wendy Suzuki: Boost Attention & Memory with Science-Based Tools | Huberman Lab Podcast #73,61.0,https://www.youtube.com/watch?v=099hgtRoUZw&list=UU2D2CMWXMOVWx7giW1n3LIg&index=61&pp=iAQB,Dr. Wendy Suzuki: Boost Attention & Memory with Science-Based Tools | Huberman Lab Podcast #73,https://i.ytimg.com/vi/099hgtRoUZw/hqdefault.jpg?sqp=-oaymwEcCNACELwBSFXyq4qpAw4IARUAAIhCGAFwAcABBg==&rs=AOn4CLCHFNc6AhY9hhgYivOJAyxxc5DIKA
61,Understand & Improve Memory Using Science-Based Tools | Huberman Lab Podcast #72,62.0,https://www.youtube.com/watch?v=szqPAPKE5tQ&list=UU2D2CMWXMOVWx7giW1n3LIg&index=62&pp=iAQB,Understand & Improve Memory Using Science-Based Tools | Huberman Lab Podcast #72,https://i.ytimg.com/vi/szqPAPKE5tQ/hqdefault.jpg?sqp=-oaymwEcCNACELwBSFXyq4qpAw4IARUAAIhCGAFwAcABBg==&rs=AOn4CLCOgwU4EQRc6y0cgPqoBAGqu12CGQ
